Clothing ID,Age,Title,Review Text,Rating,Recommended IND,Positive Feedback Count,Division Name,Department Name,Class Name
1077,60,Some major design flaws,"I had such high hopes for this dress and really wanted it to work for me. i initially ordered the petite small (my usual size) but i found this to be outrageously small. so small in fact that i could not zip it up! i reordered it in petite medium, which was just ok. overall, the top half was comfortable and fit nicely, but the bottom half had a very tight under layer and several somewhat cheap (net) over layers. imo, a major design flaw was the net over layer sewn directly into the zipper - it c",3,0,0,General,Dresses,Dresses
1080,49,Not for the very petite,"I love tracy reese dresses, but this one is not for the very petite. i am just under 5 feet tall and usually wear a 0p in this brand. this dress was very pretty out of the package but its a lot of dress. the skirt is long and very full so it overwhelmed my small frame. not a stranger to alterations, shortening and narrowing the skirt would take away from the embellishment of the garment. i love the color and the idea of the style but it just did not work on me. i returned this dress.",2,0,4,General,Dresses,Dresses
1077,53,Dress looks like it's made of cheap material,Dress runs small esp where the zipper area runs. i ordered the sp which typically fits me and it was very tight! the material on the top looks and feels very cheap that even just pulling on it will cause it to rip the fabric. pretty disappointed as it was going to be my christmas dress this year! needless to say it will be going back.,3,0,14,General,Dresses,Dresses
1077,31,Not what it looks like,"First of all, this is not pullover styling. there is a side zipper. i wouldn't have purchased it if i knew there was a side zipper because i have a large bust and side zippers are next to impossible for me.

second of all, the tulle feels and looks cheap and the slip has an awkward tight shape underneath.

not at all what is looks like or is described as. sadly will be returning, but i'm sure i will find something to exchange it for!",2,0,7,General,Dresses,Dresses
697,31,Falls flat,"Loved the material, but i didnt really look at how long the dress was before i purchased both a large and a medium. im 5'5"" and there was atleast 5"" of material at my feet. the gaps in the front are much wider than they look. felt like the dress just fell flat. both were returned. im usually a large and the med fit better. 36d 30 in jeans",3,0,0,Initmates,Intimate,Lounge
949,33,Huge disappointment,I have been waiting for this sweater coat to ship for weeks and i was so excited for it to arrive. this coat is not true to size and made me look short and squat. the sleeves are very wide (although long). as a light weight fall coat the sleeves don't need to be as wide because you wouldn't be layerng too much underneath. the buttons need to be moved at least three inches in for a nicer fit. i thought about redoing the buttons myself but the sleeves looked even more out of proportion with a tigh,2,0,0,General,Tops,Sweaters
949,36,Mehh,"I ordered this 3 months ago, and it finally came off back order. a huge disappointment. the fit wasn&#39;t so much the issue for me. the quality of the wool is subpar. someone else mentioned a &quot;felted wool&quot;...i guess, is that what you call it?  it does literally feel like felt! super thin, itchy, doesn&#39;t drape very well, and feels cheap (made in china). i got it on sale, but still not worth what i paid. definitely going back.",2,0,0,General,Tops,Sweaters
368,33,,"I am pregnant and i thought this would be a great sleep bra. it's soft and fits okay, but it has zero support or shape. i would only buy if you are a b cup or smaller and can get away without support. if i would have seen this is the store, i would have passed over it. however, i was too lazy to return so i am wearing it. it's comfortable so that's a redeeming quality. i would not recommend for larger chested ladies, though!",2,0,3,Initmates,Intimate,Intimates
862,31,"Boring front, great back",This tank fit well and i loved the ruffle in the back and how it layed. but the front was not a good look and i will be retuning it.,3,0,0,General,Tops,Knits
368,36,Itchy tags,"3 tags sewn in, 2 small (about 1'' long) and 1 huge (about 2'' x 3''). very itchy so i cut them out. then the thread left behind was plasticy and even more itchy! how can you make an intimates item with such itchy tags? not comfortable at all! also - i love bralettes and wear them all the time including to work. i am a b cup. however, this one is so thin and flimsy that it gives no support even to a b cup - so for me this would only be a lounging bralette - if it wasn't so itchy!",1,0,0,Initmates,Intimate,Intimates
862,37,I wanted to love this top...,"I really loved this top online and wanted to love it in person. it is soft and the patter is okay in person. the neckline is higher than i am used to. also, there are two buttons in the back that must be unbuttoned in order to wear the top. it is difficult to button them behind your neck with the top on. unfortunately i had to return this item...",2,0,0,General,Tops,Knits
1078,56,Great summer fabric!,"I really wanted this to work. alas, it had a strange fit for me. the straps would not stay up, and it had a weird fit under the breast. it worked standing up, but the minute i sat down it fell off my shoulders. the fabric was beautiful! and i loved that it had pockets.",3,0,1,General Petite,Dresses,Dresses
822,36,Short and boxy,"Why do designers keep making crop tops??!! i can't imagine this would be flattering on anyone, especially someone average height and well endowed on top. i looked like a football player. the pattern and fabric are gorgeous, so if you are like 4' tall and super tiny and can fit xxs this may work? i am between a 6-8 and fit a small and it was huge on me and almost was bigger at the bottom than the top. such a weird cut. there is a cami underneath so if it rides up that will show but that is so 80s",2,0,0,General,Tops,Blouses
850,28,Zipper broke,"The zipper broke on this piece the first time i wore it. very disappointing since i love the design. i'm actually going to try to replace the zipper myself with something stronger, but annoying that it's come to that.",2,0,0,General Petite,Tops,Blouses
866,58,,"I was really hoping to like this, but it did not look the way it does on the model, at least not on me. the sharkbite hem is much more pronounced and looser. the one in the photo looks like it was pinned back. i am 5'8"" and usually wear a medium or large. i got a medium and there was a lot more material on the bottom half than the photo shows. it made me look bigger and was not flattering. material has a nice weave but it's thin and delicate. i bought the (holly) deep olive and the blue. colors",1,0,2,General Petite,Tops,Knits
845,38,Huge,"Really cute piece, but it's huge. i ordered an xxs petite and it was unfortunately extremely wide and not flattering. returning.",2,0,4,General Petite,Tops,Blouses
845,44,,"I usually wear a medium and bought a small. it fit ok, but had no shape and was not flattering. i love baby doll dresses and tops, but this was a tent. my daughter saw me try it on and said ""that's a piece of tablecloth."" it's going back.",1,0,0,General Petite,Tops,Blouses
861,44,Huge,"I was very excited to order this top in red xs. so cute, but it was huge, shapeless and support thin! it had to go back. i should've looked at other reviews.",1,0,0,General Petite,Tops,Knits
861,33,Pernette henley,"I am in need of easy comfortable tops for everyday wear. i bought this top mostly because of the cute buttons. when i received it, it looked exactly as it does in the picture online, however, the buttons kept slipping out of their homes because the holes were slightly too big. the shirt fit but was just a tad snug near the upper arms, which would stretch and loosen up throughout the day. it's definitely a comfortable shirt, but it felt more like a pajama top. it's going back.",3,0,17,General Petite,Tops,Knits
822,23,Not a fan,The fabric felt cheap and i didn't find it to be a flattering top. for reference i am wearing a medium in the photos and my measurements are 38-30-40.,2,0,9,General,Tops,Blouses
863,51,,"Runs big and looked unflattering. i am petite, might work on someone taller.",2,0,0,General,Tops,Knits
861,44,Poor quality,This is so thin and poor quality. especially for the price. it felt like a thin pajama top. the buttons are terrible little shell buttons. this could not have been returned faster.,1,0,11,General Petite,Tops,Knits
1082,32,Disappointing quality,"The design/shape of the dress are quite flattering, flirty and feminine. but.... there is no way that the dress i received is new. the color is a faded washed out red and there are black stains all over the belt area. there is no tag... the fabric looks droopy and laundered and is not crisp, stiff or new. i am very disappointed by the quality of the item that i received. undoubtedly this one is going back.

dear retailer - please make sure that you do not send pre-owend clothing articles to",2,0,0,General,Dresses,Dresses
850,37,Awkward fitting,"First, the fabric is beautiful and lovely for spring and summer. i really wanted to like this top, but the fitting is so awkward for me. i typically where a 0/xs, and sized up in the shirt to a size 2. it was very tight and pulled funny across the chest (size 32/a). i also found the cut at the shoulders very narrow (need a strapless bra) and made it look unflattering overall. had to return this one back to the store.",2,0,0,General,Tops,Blouses
923,50,"Lovely top, not lovely shape","I was so excited to try out this top since it was such a bargain and neutral. unfortunately, the shape is ""a"" line and accentuates the hip area a bit more than i find flattering. so, it will be returned.",3,0,2,General,Tops,Sweaters
829,39,"Beautiful, but scratchy","My firned tried this on and her first comment was ""take it off, it is scratchy"", so i didn't bother trying it on. it is, however, beautiful, if you are not sensitive to scratchy material.
fit was true to size.",3,0,9,General,Tops,Blouses
829,53,Not impressed...,"Not keeping this one. the fabric is a bit tacky-looking in person, the cut is odd and it's just not me. fit is fine and there are snaps to keep the neckline flat and shaped, the colors are as shown and it is a good length (falls to top of hip). i simply did not like it. too metallic looking maybe...",3,0,0,General,Tops,Blouses
523,43,Australian sizing!!,So  disappointed that no where in the limiting did it mention this suit is australian in size!! i ordered the 10 (i'm usually an 8 but that was sold out) and the suit arrives and doesn't even fir over my hips. -- the label clearly says 10 australian us 6!  gutted that i have to return this suit because of this sizing issue.  the suit looks to be well made and the design is adorable of it only for.,3,0,2,Initmates,Intimate,Swim
829,52,"Scratchy, uncomfortable top","The title says it all....this fabric of this top is both the best and worst part of the design. the colors are vibrant and the combination of materials (shoulder is a knit, sweater-like navy fabric) is interesting. however, that is where the positive comments end on this one. the top is so scratchy,, stiff, and, frankly, uncomfortable. i cannot imagine wanting to wear it. it could benefit from a lining, and that might have solved the problem of scratchy, itchy fabric.

the stiff fabric of the bo",1,0,8,General Petite,Tops,Blouses
829,35,,,3,0,0,General Petite,Tops,Blouses
1094,35,Not for me,"The colors are vivid and perfectly autumnal but the fit is a mess. it was overall too large, the waistline curves up in the front and then falls into small pleats which was maternityish, the waistband was thicker than the dress and sat away from my body and the material was a cheapish poly. had the outer dress been made from the same material as the lining, i would have liked it better. the modesty closure was a plus but the dress was already unraveling when i took it out. #returned",2,0,0,General Petite,Dresses,Dresses
895,33,Not as pictured.,"Online, this looks like a great sweater. i ordered an xxsp and found that this sweater is much wider in the middle than pictured. in fact, i'm pretty sure they pinned the shirt in the back for the picture to make it appear slimmer. unfortunately, this sweater will not work for me, as i am an hourglass shape and this shirt makes me look 20 pounds heavier.",2,0,8,General,Tops,Fine gauge
895,35,"Fits strange, flimsy material","I was worried about this item when i ordered it because of how it looks in the picture, but i had wishful thinking. i should have gone with my gut! this shirt does not have the same quality as all my other retailer purchases. it is see-through and flimsy. the bottom is just like the picture, it hangs in an odd rumpled way. the top is very flattering though, so it's a shame! if the bottom fit nicer like their other products i could have gotten away with wearing a cami under it to make up for the qu",2,0,0,General,Tops,Fine gauge
895,52,Nice but too thin,"I was minimally torn over whether to return this but ultimately it's going back because the knit is just too thin. i thought it would be cozy and be of normal sweater weight but it's not. and because it's so light, the swing effect doesn't really come off. nothing special.",2,0,3,General Petite,Tops,Fine gauge
1020,49,Poor quality,"This skirt looks exactly as pictured and fits great. i purchased it a few weeks ago and got lots of compliments on it. however, on the third wear, the side zipper split wide open. needless to say, it was returned.",3,0,0,General Petite,Bottoms,Skirts
895,43,Huuuuge,"Dang, i got a small and was still swimming in it. it's made of the fabric that increasingly seems to be the fabric of choice for all things t-shirty- soft and thin-ish, a bit translucent. i'd rather wait for something more formfitting and flattering- back it went.",3,0,0,General,Tops,Fine gauge
895,36,Not worth cost,"Bought this item on sale and was very disappointed in the quality for the cost. fabric feels cheap, like it will snag easily and will stretch out quickly. did not flatter the female form- felt like a burlap sack. gorgeous blue color but not worth the price tag. returned it.",3,0,0,General,Tops,Fine gauge
828,56,Too big,"I loved this top; it reminded me of one i have from retailer from circa 2008 in black and white; however, on this one, the chest area is too big, in both the 14 and 16, and i even found myself tugging downward on the fabric to keep it in place because the waist is elastic and also too big. i probably need a size 12, but then i fear it would be too short-waisted on me, for i am 5'10"". unfortunately, it is not for me. also, the sleeves are much bigger and flouncier than they appear in the photo on t",4,0,4,General,Tops,Blouses
1020,48,Runs small too bad....,"I love the rich deep color and the style but once again this brand runs really small in the waist. i am normally a 8/10 in retailer skirts and the size 10 was tight at the waist enough so i could not button it and feel comfortable. the quality is ok, something i feel i would see at another type of discount store. for me this skirt did not work but the color and softness of the fabric was a plus.",3,0,9,General Petite,Bottoms,Skirts
862,44,,Love the fabric of this shirt even though it was thinner than i expected. it is soft to the skin and flattering. however i returned it because it is made for women with long torso and shorter shoulders.,1,0,1,General,Tops,Knits
1020,67,Not as pictured!,"The skirt that i received had very little blue or green in it, and was mostly white, yellow and some red. the fit was fine but the quality for the price was not there for me. the lack of quality and the disappointment in the quality equals a return.",1,0,17,General Petite,Bottoms,Skirts
305,46,Very small,"Bought a large, could barely pull up over my butt. runs extremely small. it's cute but if your not a stick figure, this is not the suit for you.",2,0,0,Initmates,Intimate,Swim
840,37,Light & large,"The shirt is absolutely cute looking. but that's just that....looks. i'm 5'2"" size 6 & wears m to l top. i tried on the medium in the store, it was rather flowing. i liked it. but i didn't like how it fit on the underarm area. it hung very low. so i ordered a petite m. still the same. plus the store the lighting was dark so i didn't realize how see through the shirt was too. had to return it.",2,0,1,General,Tops,Blouses
1066,42,Not what i expected,I have a similar pair of capris from retailer and when i ordered these i thought they were the same in a different color. these are less flattering and i may not keep them.,2,0,0,General,Bottoms,Pants
840,56,,"I love the style of this top, and the longer length would be great with leggings and fitted shorts. it's somewhat fitted on the top yet it's a-line shape gives a full swing at the bottom. the ruffled v-neckline is pretty, and i like the longer length of the short sleeves. but with all these attributes, unfortunately they cut the armholes really big, so when you put your arms forward, the sleeves pull against your arms. i was trying to decide if i should keep it anyway, but for $98 dollars i thin",3,0,20,General,Tops,Blouses
647,32,"Loved this, then washed it twice and it fell apart","I loved this dress from the moment i tried it on. so flattering to my postpartum body without being a huge tent. soft fabric, and for a white/lightly striped dress, not sheer. i'm bummed because after washing only twice (followed the instructions to wash) on gentle cycle and low tumble dry, holes started appearing everywhere, both on the cream ribbed hem in the front bottom and all across the chest, in the white part of the fabric only (it looks like the black stripes are holding the holes toget",1,0,3,General Petite,Intimate,Lounge
840,48,Fits like a maternity top,"Fits well through the shoulders and arms, but there is zero waist, and it just looks like a bunch of extra fabric hanging from the top. super cute, but have to return because of that.",3,0,1,General,Tops,Blouses
878,47,"Cute, but no go!","I really wanted to love this t and was excited to receive it in the mail. i thought i was being realistic in assuming that is would be somewhat sheer given that there doesn't seem to be a woman's white t on the planet that isn't these days, however it was really sheer. the fit was also short and boxy (this coming from a 5'3 woman who is short-waisted) on the plus size the material is extremely soft and the design is cute. maybe if you are younger and don't mind the sheerness it's worth the gambl",3,0,1,General,Tops,Knits
868,42,,"Like the other reviewer said this top is extremely wide and boxy. it must be pinned in the picture online. it's very frustrating when they do that. thank goodness i didn't pay for shipping! for reference, i'm 5'2 and 135 pounds and bought the xxs, it's going back for sure. i'm trying to lose baby weight, not trying to look pregnant!",2,0,1,General,Tops,Knits
878,46,"Not much structure, boxy...","I wanted to love this sweatshirt, but alas, it is going back. upon opening and unfolding, the first thing i noticed: the dots and not solid. they are sort of distressed looking, with parts of them missing. secondly, it doesn't have a lot of structure. it's soft and kind of floppy but in a weird way. it's just not flattering on me. it looks more like a pajama top than something i would wear out of the house. for reference, i ordered the 3, and i'm usually a 10/12 in tops.",2,0,0,General,Tops,Knits
1089,37,Runs large and zipper sticks,"Looks beautiful online but has too much material and the zipper catches on the lace. also runs very large, i am normally a small but would need and xs in this dress",3,0,6,General Petite,Dresses,Dresses
844,34,Very unflattering,True to size on the neckline and arms but extremely large and puffy in the torso. very unflattering cut!,3,0,0,General Petite,Tops,Blouses
836,60,Didn't work for me,"I thought this top was adorable in the store and online. it just didn't work for me. although it fit, it flares out too much in the front and just wasn't flattering on me. i am 5' 5"" and 128 lbs. and ordered the small.",3,0,3,General,Tops,Blouses
844,43,Disappointing!,"Like another reviewer mentioned, this shirt is way too short. i'm only 5'2"" (xs) and there is no way this top would tuck in like on the model. also, the quality isn't great as it's very thin and there are strings hanging from some of the seams in the front. it's a shame b/c the print is really pretty and there is this cute little bicycle charm on the tag which makes it feel more unique. sadly, it's going back!",2,0,0,General Petite,Tops,Blouses
844,41,Awkward fit,"I had high hopes for this top. really boxy, short",3,0,0,General Petite,Tops,Blouses
844,53,Not a good fit,"This top was way too short (i'm only 5'1) and way too wide. the cut of this top was so wide, it looked like a tent on me. i really wanted to love this top because the material and style (sleeves, ruffle) are beautiful, unfortunately there is something wrong with the cut. i've have several blouses made by one fine day, which fit nicely, for some reason this top did not. i ordered in my usual s size, even going to an xs would not work because the cut is wrong.",1,0,17,General Petite,Tops,Blouses
844,44,,Gorgeous in every way except its length and how it hangs at the bottom. i prefer a shirt i can wear tucked in or out. this one will work well tucked in but not out so i am returning disappointed it was so well done in other particulars.,3,0,2,General Petite,Tops,Blouses
836,27,"Cute top, but not for me","This top light and airy, which is perfect for spring. i'm usually into these types of blouses; however, this didn't quite fit right on me. it's a little too boxy and too low cut in the front for some reason. i loved the design and really wanted to like it... i just didn't love it enough to purchase it.",3,0,15,General,Tops,Blouses
844,36,So disappointed! please fix it!,"This blouse is so beautiful - the collar, sleeves, material...everything except the cut! it was like a tent. it needed to be more tapered, which would be easy to do while still maintaining the beautiful breezy flow, and be about two inches longer.

i had been drooling over this top for awhile and was so disappointed! please fix it and then i will buy again. i am 5'4"", 140lbs and busty...a small was perfect, with the exception of the massive amount of material.",2,0,0,General Petite,Tops,Blouses
936,32,Sweater not a coat,"Not a coat by any means, merely a thin wool boucle like sweater with a cheap thin synthetic lining ---and i also would never want the lining to be seen by anyone if i were to set the sweater on a chair or be helped in putting the thing on. the length and bulk is hard to layer under anything else and isn't pretty enough for a spring coat..sizing is also 2 sizes larger than anticipated.",2,0,0,General Petite,Tops,Sweaters
831,42,Could have been cute...,"The fabric was nothing special (i usually like a cotton/silk blend woven fabric, but this was stiff feeling) and the pattern was cute. but what made me return it was the fact that 1) the rose gold glitter dots are puffy paint. literally. puffy. paint. and 2) the dots were not quite dry on my top when it arrived. parts of the paint came off on my fingers and the top was stuck to itself because of it. i could barely unfold it.

i'm sure this could have been cute, but who wants a top that looks lik",1,0,6,General,Tops,Blouses
862,34,Almost but not quite,This top is good quality and cute. it runs large- i'm usually a medium and needed a small. the reason i will be returning it is because it flares out at the bottom on the black which is very unflattering on. it makes me look wide in the waist or like i'm wearing a maternity top. unfortunate because i really liked everything else about it.,3,0,0,General Petite,Tops,Knits
836,65,Cute but ...,"This blouse is super cute but oddly sized. i bought a size up and still i squeezed into the top around the bust. the front slit is too low and shows a bit too much cleavage, so this had to go back. i really tried because the fabric is wonderful and the shirt is light and breezy for summer, i just couldn't make it work
.",3,0,0,General,Tops,Blouses
836,29,,"I love maeve and was so excited for this top which looked like an update from a last season favorite. unfortunately the fabric was stiff, it was tight in the chest and went straight down from there. returned.",2,0,0,General,Tops,Blouses
862,37,Just okay,"I was looking for a basic tee, but this one was just ok...the quality is okay, but it us not as soft as i would have liked. unfortunately,  i will be returning this item.",3,0,0,General,Tops,Knits
1104,59,Poor quality,Disappointed in the quality of the dress. love the style and especially the colors. the fabric of the body of the dress is very very thin and just poorly made. the top bodice is more substantial. not worth the price tag of $148.00. dress does run short.,3,0,13,General,Dresses,Dresses
995,41,Poorly executed,"This skirt is very short. i ordered my usual xs petite and it was so short that the longest part ended above my ankle. that's quite off because i'm only 5 feet tall, and i wore it pretty low on the hips. it also flares out awkwardly below the knee. there are 2 vertical seems and they exacerbate the jagged appearance of the hem. i was drawn to the edgy style shown in the photo but in person it looks like my 5 year old cut up a skirt. plus, the fabric--while thick and beautiful and stretchy--has a",2,0,11,General,Bottoms,Skirts
